{
  "id": "CLM-irap-hosting",
  "statement": "IRAP (run by ASD, assessing against ISM/PSPF) remains an active assessment program, and government data-centre/hosting assurance is administered via the DTA Hosting Certification Framework (which replaced the Cloud Services Certification Program, ceased 2 March 2020).",
  "verdict": "verified",
  "evidence": [
    {
      "source_id": "SRC-irap",
      "quote": "independent security assessment services... against the ISM",
      "retrieval_date": "2026-06-01",
      "independent": true
    },
    {
      "source_id": "SRC-hosting-cert",
      "quote": "the Cloud Services Certification Program (CSCP) ceased on 2 March 2020",
      "retrieval_date": "2026-06-01",
      "independent": true
    }
  ],
  "contested": false,
  "falsifier": "cyber.gov.au showing IRAP discontinued, or DTA showing the Hosting Certification Framework retired, would falsify this.",
  "control_anchor": {
    "framework": "IRAP",
    "control_id": "ISM/PSPF assessment",
    "relationship": "informs"
  },
  "classification": "OFFICIAL",
  "trust": "trusted",
  "consumer_profile": [
    "own-agency",
    "other-gov-orgs"
  ],
  "tags": [
    "compliance-anchor"
  ],
  "date": "2026-06-01"
}
