{
  "id": "CLM-agentsmd-is-convention-not-emitter",
  "statement": "AGENTS.md is a Linux-Foundation-stewarded single-file Markdown CONVENTION read natively by major agents; it is NOT an author-once-emit-to-many build system and adds no templating or security validation, so convergence on it shrinks the need for any emitter.",
  "verdict": "verified",
  "evidence": [
    {
      "source_id": "SRC-agentsmd-site",
      "quote": "A simple, open format... just standard Markdown. No JSON schema, no YAML, no special syntax. Stewarded by the Agentic AI Foundation under the Linux Foundation. Over 60,000 projects.",
      "retrieval_date": "2026-06-01",
      "independent": true
    },
    {
      "source_id": "SRC-agentsmd-repo",
      "quote": "A README for agents... 21.9k stars. No multi-target emit, templating, or security validation in the convention.",
      "retrieval_date": "2026-06-01",
      "independent": true
    }
  ],
  "contested": false,
  "falsifier": "Evidence AGENTS.md spec adds a resolution/templating layer or that agents stopped reading it natively, re-creating the need for per-agent emit.",
  "classification": "OFFICIAL",
  "trust": "trusted",
  "consumer_profile": [
    "own-agency",
    "other-gov-orgs",
    "vendor-baseline"
  ],
  "tags": [
    "substrate"
  ],
  "date": "2026-06-01"
}
